"entity","termID","term","definition","dataType","minrange","maxrange","units","sourcedefinition","unboundeddefinition","enumerateddomain","NAorBlankcell","NAdefinition","examples","standard"
"Event",200,"locationID","Unique global identifier assigned to the location where the event occurred.","Integer","1","11585",NA,"Producer defined",NA,NA,NA,NA,NA,NA
"Event",300,"eventID","Global unique identifier assigned to an Event (something that occurs at a place and time, such as a survey or measurement).","Integer","1","16280",NA,"Producer defined",NA,NA,NA,NA,NA,"Darwin Core"
"Event",301,"verbatimEventID","The verbatim event ID from the originating source dataset assigned by the program.","String",NA,NA,NA,"Producer defined","Unbounded list of alphanumeric text",NA,"NA","Event ID was not included or reported in the source dataset.","FFFE9F28-60DB-40C0-B9C0-4AFC753A9880, 10002","Producer defned"
"Event",302,"eventDate","The calendar date of the event from the source data.","Date","2000-05-20","2020-10-20","calendar date (yyyy-mm-dd)","Producer defined",NA,NA,"NA","Source data from AREMP do not contain month or day, so no there is no eventDate for those entries.",NA,"Darwin Core"
"Event",303,"year","The four-digit year in which the event occurred.","Date","2000","2020","calendar year (yyyy)","Producer defined",NA,NA,NA,NA,"2008","Darwin Core"
"Event",304,"samplingProtocol","The name of, reference to, or description of the stream survey method or protocol used during an Event.","String",NA,NA,NA,"Producer defined",NA,"y",NA,"Sampling Protocol was not included or reported in the source dataset.","UV light trap, ""mist net"", ""bottom trawl"", ""ad hoc observation"", ""point count"", ""Penguins from space: faecal stains reveal the location of emperor penguin colonies, http://dx.doi.org/10.1111/j.1466-8238.2009.00467.x"", ""Takats et al. 2001. Guidelines for Nocturnal Owl Monitoring in North America. Beaverhill Bird Observatory and Bird Studies Canada, Edmonton, Alberta. 32 pp."", ""http://www.bsc-eoc.org/download/Owl.pdf""","Darwin Core"
"Event",305,"fieldNotes","The description of flow for the reach (flow, partial flow or dry).","String",NA,NA,NA,"Producer defined",NA,"y","NA","Description of the flow was not included or reported in the source dataset.","dry, wet","Darwin Core"
"Event",306,"beaverImpactFlow","Beaver impact the flow of the reach.","String",NA,NA,NA,"Producer defined",NA,"y","NA","Beaver impacts were not reported in the source data.",NA,"Producer defned"
